{
  "schema_version": "exitdrill/baseline/v0.3",
  "drill_id": "directus-civic-case-exit-001",
  "source_system": "Directus 11.17.4 synthetic civic-case sandbox",
  "captured_at": "2026-08-02T02:38:28.400Z",
  "coverage": {
    "entities": "complete",
    "relationships": "complete",
    "attachments": "complete",
    "permissions": "complete",
    "audit_events": "complete"
  },
  "entities": [
    {
      "type": "person",
      "id": "1",
      "required_fields": [
        {"name": "display_name", "type": "string", "expected_value": "Synthetic Person Alpha"},
        {"name": "active", "type": "boolean", "expected_value": true}
      ]
    },
    {
      "type": "person",
      "id": "2",
      "required_fields": [
        {"name": "display_name", "type": "string", "expected_value": "Synthetic Person Bravo"},
        {"name": "active", "type": "boolean", "expected_value": true}
      ]
    },
    {
      "type": "person",
      "id": "3",
      "required_fields": [
        {"name": "display_name", "type": "string", "expected_value": "Synthetic Person Canary"},
        {"name": "active", "type": "boolean", "expected_value": false}
      ]
    },
    {
      "type": "case",
      "id": "1",
      "required_fields": [
        {"name": "status", "type": "string", "expected_value": "open"},
        {"name": "priority", "type": "number", "expected_value": 2},
        {"name": "document", "type": "string", "expected_value": "11111111-1111-4111-8111-111111111111"}
      ]
    },
    {
      "type": "case",
      "id": "2",
      "required_fields": [
        {"name": "status", "type": "string", "expected_value": "open"},
        {"name": "priority", "type": "number", "expected_value": 3},
        {"name": "document", "type": "string", "expected_value": "22222222-2222-4222-8222-222222222222"}
      ]
    },
    {
      "type": "directus_collection_scope",
      "id": "exitdrill_cases",
      "required_fields": [
        {"name": "collection", "type": "string", "expected_value": "exitdrill_cases"}
      ]
    },
    {
      "type": "directus_collection_scope",
      "id": "exitdrill_people",
      "required_fields": [
        {"name": "collection", "type": "string", "expected_value": "exitdrill_people"}
      ]
    }
  ],
  "relationships": [
    {
      "type": "assigned_to",
      "from_type": "case",
      "from_id": "1",
      "to_type": "person",
      "to_id": "1"
    },
    {
      "type": "assigned_to",
      "from_type": "case",
      "from_id": "2",
      "to_type": "person",
      "to_id": "2"
    }
  ],
  "attachments": [
    {
      "id": "11111111-1111-4111-8111-111111111111",
      "owner_type": "case",
      "owner_id": "1",
      "content_sha256": "71bcf1dbe17580338192d03a52e2ba5027ac08108a3c24441b1970df8a43cc31"
    },
    {
      "id": "22222222-2222-4222-8222-222222222222",
      "owner_type": "case",
      "owner_id": "2",
      "content_sha256": "b4a1c0ab3025360613416808fb3a56e0dea622431b07e0aa6a2cd7eeaae8f9a4"
    }
  ],
  "permissions": [
    {
      "principal_id": "policy:33333333-3333-4333-8333-333333333333",
      "scope_type": "directus_collection_scope",
      "scope_id": "exitdrill_cases",
      "role": "read:0fcaa4ece823393f4e5ccfc2426e26859693cf80052aaf4b8b78c7ceb3e45a8c"
    },
    {
      "principal_id": "policy:33333333-3333-4333-8333-333333333333",
      "scope_type": "directus_collection_scope",
      "scope_id": "exitdrill_people",
      "role": "read:ce05c47ea42741b5272eccf39dd56d55f7e8d373dbff4c9d6da220266215a38b"
    }
  ],
  "audit_events": [
    {
      "event_id": "directus_activity:21",
      "object_type": "case",
      "object_id": "1",
      "action": "create",
      "occurred_at": "2026-08-02T02:38:28.259Z"
    },
    {
      "event_id": "directus_activity:22",
      "object_type": "case",
      "object_id": "2",
      "action": "create",
      "occurred_at": "2026-08-02T02:38:28.269Z"
    }
  ]
}
